{
  "platform": "Bukkit",
  "status": null,
  "versions": "1.8",
  "spigot": 36140,
  "github": "hugo4715/KnockbackPlusPlus",
  "price": "Free",
  "links": [
    {
      "name": "SpigotMC",
      "url": "https://spigotmc.org/resources/36140"
    },
    {
      "name": "GitHub",
      "url": "https://github.com/hugo4715/KnockbackPlusPlus"
    }
  ]
}