{
  "platform": "Bukkit",
  "status": null,
  "versions": "1.8 - 1.21",
  "spigot": 112053,
  "github": null,
  "price": "Free",
  "links": [
    {
      "name": "SpigotMC",
      "url": "https://spigotmc.org/resources/112053"
    },
    {
      "name": "GitHub",
      "url": "https://github.com/tiredvekster/LightAntiCheat"
    }
  ]
}