{
  "platform": "Bukkit",
  "status": null,
  "versions": "1.8 – 26.1.2",
  "spigot": 112430,
  "github": "ChromMob/BaritoneRemover",
  "price": "Free",
  "links": [
    {
      "name": "GitHub",
      "url": "https://github.com/ChromMob/BaritoneRemover"
    },
    {
      "name": "Modrinth",
      "url": "https://modrinth.com/plugin/baritoneremover"
    },
    {
      "name": "SpigotMC",
      "url": "https://spigotmc.org/resources/112430"
    },
    {
      "name": "Discord",
      "url": "https://discord.gg/xG8beHPXUS"
    }
  ]
}