{
  "platform": "Bukkit",
  "status": "Active",
  "versions": "1.8 - 1.21.11",
  "spigot": null,
  "github": null,
  "price": "Contact for info",
  "links": [
    {
      "name": "Dedicated Site",
      "url": "https://verdantstudios.xyz"
    },
    {
      "name": "Discord",
      "url": "https://dc.gg/verdantstudios"
    }
  ]
}
