{
  "platform": "Bukkit",
  "status":  null,
  "versions": "1.7.10",
  "spigot": null,
  "github": "Y4nN0xX/Argus-Anticheat-minecraft-1.7.10-Paladium",
  "price": "Free",
  "links": [
    {
      "name": "GitHub",
      "url": "https://github.com/Y4nN0xX/Argus-Anticheat-minecraft-1.7.10-Paladium"
    }
  ]
}