{
  "platform": "Bukkit",
  "status": null,
  "versions": "1.20 - 1.21.7",
  "spigot": 124801,
  "github": null,
  "price": "Free",
  "links": [
    {
      "name": "SpigotMC",
      "url": "https://spigotmc.org/resources/124801"
    },
    {
      "name": "Discord",
      "url": "https://discord.gg/ZQx4wk2a3B"
    }
  ]
}