{
  "platform": "Bukkit",
  "status": null,
  "versions": "1.13 - 1.17",
  "spigot": 92180,
  "github": null,
  "price": "Free",
  "links": [
    {
      "name": "SpigotMC",
      "url": "https://spigotmc.org/resources/92180"
    },
    {
      "name": "Bukkit",
      "url": "https://dev.bukkit.org/projects/flappy-anticheat-1-16-1-17"
    }
  ]
}