{
  "platform": "Bukkit",
  "status": "Active",
  "versions": "1.8.8, 1.12.2 - 1.21",
  "spigot": null,
  "github": null,
  "price": "$22.00, $129.00, $15.00/mo $1300.00, $4000.00 (?)",
  "links": [
    {
      "name": "BuiltByBit",
      "url": "https://builtbybit.com/resources/13999"
    },
    {
      "name": "Dedicated Site",
      "url": "https://matrix.rip"
    },
    {
      "name": null,
      "url": "https://spigotmc.org/resources/64635"
    }
  ]
}