{
  "platform": "Skript",
  "status": null,
  "versions": "Unknown",
  "spigot": null,
  "github": "steviebeenz/BubbleAnticheatReborn",
  "price": "Free",
  "links": [
    {
      "name": "Dedicated Site",
      "url": "https://steviebeenz.github.io/BubbleAnticheatReborn"
    },
    {
      "name": "GitHub",
      "url": "https://github.com/steviebeenz/BubbleAnticheatReborn"
    }
  ]
}