{
  "platform": "Bukkit",
  "status": null,
  "versions": "1.8 - 1.12",
  "spigot": 53281,
  "github": "MSWS/NESS",
  "price": "Free",
  "links": [
    {
      "name": "SpigotMC",
      "url": "https://spigotmc.org/resources/53281"
    },
    {
      "name": "GitHub",
      "url": "https://github.com/MSWS/NESS"
    }
  ]
}