{
  "platform": [
    "Bukkit",
    "Fabric"
  ],
  "status": null,
  "versions": "1.8.8 - 26.2",
  "spigot": 99923,
  "github": "GrimAnticheat/Grim",
  "price": "Free",
  "links": [
    {
      "name": "Modrinth",
      "url": "https://modrinth.com/plugin/grimac"
    },
    {
      "name": "SpigotMC",
      "url": "https://spigotmc.org/resources/99923"
    },
    {
      "name": "GitHub",
      "url": "https://github.com/GrimAnticheat/Grim"
    },
    {
      "name": "Hanger",
      "url": "https://hangar.papermc.io/GrimAnticheat/GrimAnticheat"
    },
    {
      "name": "Dedicated Site",
      "url": "https://grim.ac"
    }
  ]
}