{
  "platform": "Bukkit",
  "status": null,
  "versions": "1.8.8",
  "spigot": 83198,
  "github": "Tecnio/AntiHaxerman",
  "price": "Free",
  "links": [
    {
      "name": "SpigotMC",
      "url": "https://spigotmc.org/resources/83198"
    },
    {
      "name": "GitHub",
      "url": "https://github.com/Tecnio/AntiHaxerman"
    }
  ]
}