{
  "platform": "Bukkit",
  "status": "Discontinued",
  "versions": "1.7 - 1.13",
  "spigot": 49215,
  "github": "funkemunky/Daedalus",
  "price": "Free",
  "links": [
    {
      "name": "GitHub",
      "url": "https://github.com/funkemunky/Daedalus"
    },
    {
      "name": "SpigotMC",
      "url": "https://spigotmc.org/resources/49215"
    }
  ]
}