{
  "platform": "Bukkit",
  "status": null,
  "versions": "1.8 - 26.2",
  "spigot": 83626,
  "github": null,
  "price": "$19.99 (USD)",
  "links": [
    {
      "name": "SpigotMC",
      "url": "https://spigotmc.org/resources/83626"
    },
    {
      "name": "Discord",
      "url": "https://discord.com/invite/SCNuwUG"
    }
  ]
}