{
  "platform": "Bukkit",
  "status": "Inactive",
  "versions": "1.7 - 1.15",
  "spigot": 65622,
  "github": "Tecnio/Hades",
  "price": "Free",
  "links": [
    {
      "name": "GitHub",
      "url": "https://github.com/Tecnio/Hades"
    },
    {
      "name": "SpigotMC",
      "url": "https://spigotmc.org/resources/65622"
    }
  ]
}