{
  "platform": "Bukkit",
  "status": "Active",
  "versions": "1.8+",
  "spigot": null,
  "github": null,
  "price": "$30.00 (?)",
  "links": [
    {
      "name": "Dedicated Site",
      "url": "https://astroac.gg"
    },
    {
      "name": "Discord",
      "url": "https://discord.gg/fJGspEJnyh"
    }
  ]
}